{
  "id": "vat-exempt-below-threshold",
  "title": "VAT-exempt user remains below SEK 120000 threshold",
  "profile": {
    "taxStatus": "f_skatt",
    "vatStatus": "exempt_low_turnover",
    "ruleYear": 2026
  },
  "transactions": [
    {
      "type": "invoice_issued",
      "amountMinorExVat": 5000000,
      "vatRate": 0
    },
    {
      "type": "invoice_issued",
      "amountMinorExVat": 4500000,
      "vatRate": 0
    }
  ],
  "expected": {
    "annualTurnoverMinor": 9500000,
    "mustChargeVat": false,
    "mustRegisterForVat": false,
    "invoiceMustStateVatExemption": true,
    "thresholdWarning": "approaching"
  },
  "sources": [
    "https://www.skatteverket.se/servicelankar/otherlanguages/englishengelska/businessesandemployers/startingandrunningaswedishbusiness/registeringabusiness/incertaincasesyoudonotneedtoregisteryourbusinessforvat.4.6e1dd38d196873bc1e1cff.html"
  ],
  "milestone": 1,
  "rfcSection": "§9 test matrix"
}
