{
  "id": "year-end-k1-ne",
  "title": "K1 year-end package with NE draft",
  "profile": {
    "taxStatus": "fa_skatt",
    "vatStatus": "registered",
    "annualTurnoverMinor": 65000000,
    "ruleYear": 2026,
    "accountingRegime": "k1_simplified_annual_accounts"
  },
  "transactions": [
    {
      "type": "year_end_close_requested",
      "fiscalYear": 2026
    }
  ],
  "expected": {
    "simplifiedAnnualAccountsAllowed": true,
    "neDraftRequired": true,
    "annualAccountsStoredLocally": true,
    "exportPackageRequired": true,
    "fiscalYearLockAfterApproval": true
  },
  "sources": [
    "https://www.skatteverket.se/servicelankar/otherlanguages/englishengelska/businessesandemployers/startingandrunningaswedishbusiness/declaringtaxesbusinesses/incometax/incometaxreturnsforsoletraders.4.676f4884175c97df41913f3.html",
    "https://www.bfn.se/redovisningsregler/vad-galler-for/enskilda-naringsidkare/"
  ],
  "milestone": 5,
  "rfcSection": "§9 test matrix"
}
